<?xml version="1.0"?>
<hostmap xmlns:xsi="http://www.w3.org/2001/XMLSchema-instance"
    xsi:noNamespaceSchemaLocation="cpn.xsd">
    <host>
	<name>zeus</name>
	<node>A</node>
	<node>B</node>
	<node>C</node>
    </host>
    <host>
	<name>metis</name>
    </host>
    <host>
	<name>syrinx</name>
    </host>
</hostmap>
