<?xml version="1.0"?>
<hostprog xmlns:xsi="http://www.w3.org/2001/XMLSchema-instance"
    xsi:noNamespaceSchemaLocation="cpn.xsd">
    <name>syrinx</name>
    <hosttype>slave</hosttype>
    <hosts>
	<host>
	    <name>zeus</name>
	    <hosttype>master</hosttype>
	    <connection>
		<type>tcpip</type>
		<param>zeus.arlut.utexas.edu</param>
	    </connection>
	</host>
	<host>
	    <name>metis</name>
	    <hosttype>slave</hosttype>
	    <connection>
		<type>tcpip</type>
		<param>metis.arlut.utexas.edu</param>
	    </connection>
	</host>
	<host>
	    <name>syrinx</name>
	    <hosttype>slave</hosttype>
	    <connection>
		<type>tcpip</type>
		<param>syrinx.arlut.utexas.edu</param>
	    </connection>
	</host>
    </hosts>
    <nodes>
    </nodes>
    <queues>
    </queues>
</hostprog>

